<!ELEMENT catalog (book+)>
<!ELEMENT book (author, title, genre, price)>
<!ATTLIST book id ID #REQUIRED>
<!ELEMENT author (#PCDATA)>
<!ELEMENT title (#PCDATA)>
<!ELEMENT genre (#PCDATA)>
<!ELEMENT price (#PCDATA)>